<?xml version="1.0" encoding="UTF-8"?>
<?xml-stylesheet href="users.xsl" type:"text/xsl" ?>
<!DOCTYPE root [
<!ELEMENT root (row)+>
<!ELEMENT row (user_id,user_name,mob,email,resume_link,dob,isAdmin,gender,pwd)>
<!ELEMENT user_id (#PCDATA)>
<!ELEMENT user_name (#PCDATA)>
<!ELEMENT mob (#PCDATA)>
<!ELEMENT email (#PCDATA)>
<!ELEMENT resume_link (#PCDATA)>
<!ELEMENT dob (#PCDATA)>
<!ELEMENT isAdmin (#PCDATA)>
<!ELEMENT gender (#PCDATA)>
<!ELEMENT pwd (#PCDATA)>
]>
<root>
<!-- <root xmlns="https://w3schoools.com" xmlns:xsi="http://www.w3.org/2001/XMLSchema-instance" xsi:schemaLocation="user.xsd"> -->
  <row>
    <user_id>admin</user_id>
    <user_name>admin</user_name>
    <mob>9445147911</mob>
    <email>arjun.prs@gmail.com</email>
    <resume_link>https://docs.google.com/document/d/16FaBtLR1Ena4AdPUfJ0PO9U_-UHshnKhB-GK2Dn8cQo/edit?usp=sharing</resume_link>
    <dob>8111999</dob>
    <isAdmin>1</isAdmin>
    <gender>M</gender>
    <pwd>admin</pwd>
  </row>
  <row>
    <user_id>CB.EN.U4CSE17401</user_id>
    <user_name>Arjun R</user_name>
    <mob>9445147912</mob>
    <email>arjun.prs@gmail.com</email>
    <resume_link>https://docs.google.com/document/d/16FaBtLR1Ena4AdPUfJ0PO9U_-UHshnKhB-GK2Dn8cQo/edit?usp=sharing</resume_link>
    <dob>8112000</dob>
    <isAdmin>0</isAdmin>
    <gender>M</gender>
    <pwd>admin</pwd>
  </row>
  <row>
    <user_id>CB.EN.U4CSE17402</user_id>
    <user_name>Arjun R</user_name>
    <mob>9445147913</mob>
    <email>arjun.prs@gmail.com</email>
    <resume_link>https://docs.google.com/document/d/16FaBtLR1Ena4AdPUfJ0PO9U_-UHshnKhB-GK2Dn8cQo/edit?usp=sharing</resume_link>
    <dob>8112000</dob>
    <isAdmin>0</isAdmin>
    <gender>M</gender>
    <pwd>admin</pwd>
  </row>
  <row>
    <user_id>CB.EN.U4CSE17403</user_id>
    <user_name>Arjun R</user_name>
    <mob>9445147914</mob>
    <email>arjun.prs@gmail.com</email>
    <resume_link>https://docs.google.com/document/d/16FaBtLR1Ena4AdPUfJ0PO9U_-UHshnKhB-GK2Dn8cQo/edit?usp=sharing</resume_link>
    <dob>8112000</dob>
    <isAdmin>0</isAdmin>
    <gender>M</gender>
    <pwd>admin</pwd>
  </row>
  <row>
    <user_id>CB.EN.U4CSE17404</user_id>
    <user_name>Arjun R</user_name>
    <mob>9445147915</mob>
    <email>arjun.prs@gmail.com</email>
    <resume_link>https://docs.google.com/document/d/16FaBtLR1Ena4AdPUfJ0PO9U_-UHshnKhB-GK2Dn8cQo/edit?usp=sharing</resume_link>
    <dob>8112000</dob>
    <isAdmin>0</isAdmin>
    <gender>M</gender>
    <pwd>admin</pwd>
  </row>
  <row>
    <user_id>CB.EN.U4CSE17405</user_id>
    <user_name>Arjun R</user_name>
    <mob>9445147916</mob>
    <email>arjun.prs@gmail.com</email>
    <resume_link>https://docs.google.com/document/d/16FaBtLR1Ena4AdPUfJ0PO9U_-UHshnKhB-GK2Dn8cQo/edit?usp=sharing</resume_link>
    <dob>8112000</dob>
    <isAdmin>0</isAdmin>
    <gender>M</gender>
    <pwd>admin</pwd>
  </row>
  <row>
    <user_id>CB.EN.U4CSE17406</user_id>
    <user_name>Arjun R</user_name>
    <mob>9445147917</mob>
    <email>arjun.prs@gmail.com</email>
    <resume_link>https://docs.google.com/document/d/16FaBtLR1Ena4AdPUfJ0PO9U_-UHshnKhB-GK2Dn8cQo/edit?usp=sharing</resume_link>
    <dob>8112000</dob>
    <isAdmin>0</isAdmin>
    <gender>M</gender>
    <pwd>admin</pwd>
  </row>
  <row>
    <user_id>CB.EN.U4CSE17407</user_id>
    <user_name>Arjun R</user_name>
    <mob>9445147918</mob>
    <email>arjun.prs@gmail.com</email>
    <resume_link>https://docs.google.com/document/d/16FaBtLR1Ena4AdPUfJ0PO9U_-UHshnKhB-GK2Dn8cQo/edit?usp=sharing</resume_link>
    <dob>8112000</dob>
    <isAdmin>0</isAdmin>
    <gender>M</gender>
    <pwd>admin</pwd>
  </row>
  <row>
    <user_id>CB.EN.U4CSE17408</user_id>
    <user_name>Arjun R</user_name>
    <mob>9445147919</mob>
    <email>arjun.prs@gmail.com</email>
    <resume_link>https://docs.google.com/document/d/16FaBtLR1Ena4AdPUfJ0PO9U_-UHshnKhB-GK2Dn8cQo/edit?usp=sharing</resume_link>
    <dob>8112000</dob>
    <isAdmin>0</isAdmin>
    <gender>M</gender>
    <pwd>admin</pwd>
  </row>
  <row>
    <user_id>CB.EN.U4CSE17409</user_id>
    <user_name>Arjun R</user_name>
    <mob>9445147920</mob>
    <email>arjun.prs@gmail.com</email>
    <resume_link>https://docs.google.com/document/d/16FaBtLR1Ena4AdPUfJ0PO9U_-UHshnKhB-GK2Dn8cQo/edit?usp=sharing</resume_link>
    <dob>8112000</dob>
    <isAdmin>0</isAdmin>
    <gender>M</gender>
    <pwd>admin</pwd>
  </row>
  <row>
    <user_id>CB.EN.U4CSE17410</user_id>
    <user_name>Arjun R</user_name>
    <mob>9445147921</mob>
    <email>arjun.prs@gmail.com</email>
    <resume_link>https://docs.google.com/document/d/16FaBtLR1Ena4AdPUfJ0PO9U_-UHshnKhB-GK2Dn8cQo/edit?usp=sharing</resume_link>
    <dob>8112000</dob>
    <isAdmin>0</isAdmin>
    <gender>M</gender>
    <pwd>admin</pwd>
  </row>
  <row>
    <user_id>CB.EN.U4CSE17411</user_id>
    <user_name>Arjun R</user_name>
    <mob>9445147922</mob>
    <email>arjun.prs@gmail.com</email>
    <resume_link>https://docs.google.com/document/d/16FaBtLR1Ena4AdPUfJ0PO9U_-UHshnKhB-GK2Dn8cQo/edit?usp=sharing</resume_link>
    <dob>8112000</dob>
    <isAdmin>0</isAdmin>
    <gender>M</gender>
    <pwd>admin</pwd>
  </row>
  <row>
    <user_id>CB.EN.U4CSE17412</user_id>
    <user_name>Arjun R</user_name>
    <mob>9445147923</mob>
    <email>arjun.prs@gmail.com</email>
    <resume_link>https://docs.google.com/document/d/16FaBtLR1Ena4AdPUfJ0PO9U_-UHshnKhB-GK2Dn8cQo/edit?usp=sharing</resume_link>
    <dob>8112000</dob>
    <isAdmin>0</isAdmin>
    <gender>M</gender>
    <pwd>admin</pwd>
  </row>
  <row>
    <user_id>CB.EN.U4CSE17413</user_id>
    <user_name>Arjun R</user_name>
    <mob>9445147924</mob>
    <email>arjun.prs@gmail.com</email>
    <resume_link>https://docs.google.com/document/d/16FaBtLR1Ena4AdPUfJ0PO9U_-UHshnKhB-GK2Dn8cQo/edit?usp=sharing</resume_link>
    <dob>8112000</dob>
    <isAdmin>0</isAdmin>
    <gender>M</gender>
    <pwd>admin</pwd>
  </row>
  <row>
    <user_id>CB.EN.U4CSE17414</user_id>
    <user_name>Arjun R</user_name>
    <mob>9445147925</mob>
    <email>arjun.prs@gmail.com</email>
    <resume_link>https://docs.google.com/document/d/16FaBtLR1Ena4AdPUfJ0PO9U_-UHshnKhB-GK2Dn8cQo/edit?usp=sharing</resume_link>
    <dob>8112000</dob>
    <isAdmin>0</isAdmin>
    <gender>M</gender>
    <pwd>admin</pwd>
  </row>
  <row>
    <user_id>CB.EN.U4CSE17415</user_id>
    <user_name>Arjun R</user_name>
    <mob>9445147926</mob>
    <email>arjun.prs@gmail.com</email>
    <resume_link>https://docs.google.com/document/d/16FaBtLR1Ena4AdPUfJ0PO9U_-UHshnKhB-GK2Dn8cQo/edit?usp=sharing</resume_link>
    <dob>8112000</dob>
    <isAdmin>0</isAdmin>
    <gender>M</gender>
    <pwd>admin</pwd>
  </row>
  <row>
    <user_id>CB.EN.U4CSE17416</user_id>
    <user_name>Arjun R</user_name>
    <mob>9445147927</mob>
    <email>arjun.prs@gmail.com</email>
    <resume_link>https://docs.google.com/document/d/16FaBtLR1Ena4AdPUfJ0PO9U_-UHshnKhB-GK2Dn8cQo/edit?usp=sharing</resume_link>
    <dob>8112000</dob>
    <isAdmin>0</isAdmin>
    <gender>M</gender>
    <pwd>admin</pwd>
  </row>
  <row>
    <user_id>CB.EN.U4CSE17417</user_id>
    <user_name>Arjun R</user_name>
    <mob>9445147928</mob>
    <email>arjun.prs@gmail.com</email>
    <resume_link>https://docs.google.com/document/d/16FaBtLR1Ena4AdPUfJ0PO9U_-UHshnKhB-GK2Dn8cQo/edit?usp=sharing</resume_link>
    <dob>8112000</dob>
    <isAdmin>0</isAdmin>
    <gender>M</gender>
    <pwd>admin</pwd>
  </row>
  <row>
    <user_id>CB.EN.U4CSE17418</user_id>
    <user_name>Arjun R</user_name>
    <mob>9445147929</mob>
    <email>arjun.prs@gmail.com</email>
    <resume_link>https://docs.google.com/document/d/16FaBtLR1Ena4AdPUfJ0PO9U_-UHshnKhB-GK2Dn8cQo/edit?usp=sharing</resume_link>
    <dob>8112000</dob>
    <isAdmin>0</isAdmin>
    <gender>M</gender>
    <pwd>admin</pwd>
  </row>
  <row>
    <user_id>CB.EN.U4CSE17419</user_id>
    <user_name>Arjun R</user_name>
    <mob>9445147930</mob>
    <email>arjun.prs@gmail.com</email>
    <resume_link>https://docs.google.com/document/d/16FaBtLR1Ena4AdPUfJ0PO9U_-UHshnKhB-GK2Dn8cQo/edit?usp=sharing</resume_link>
    <dob>8112000</dob>
    <isAdmin>0</isAdmin>
    <gender>M</gender>
    <pwd>admin</pwd>
  </row>
  <row>
    <user_id>CB.EN.U4CSE17420</user_id>
    <user_name>Arjun R</user_name>
    <mob>9445147931</mob>
    <email>arjun.prs@gmail.com</email>
    <resume_link>https://docs.google.com/document/d/16FaBtLR1Ena4AdPUfJ0PO9U_-UHshnKhB-GK2Dn8cQo/edit?usp=sharing</resume_link>
    <dob>8112000</dob>
    <isAdmin>0</isAdmin>
    <gender>M</gender>
    <pwd>admin</pwd>
  </row>
  <row>
    <user_id>CB.EN.U4CSE17421</user_id>
    <user_name>Arjun R</user_name>
    <mob>9445147932</mob>
    <email>arjun.prs@gmail.com</email>
    <resume_link>https://docs.google.com/document/d/16FaBtLR1Ena4AdPUfJ0PO9U_-UHshnKhB-GK2Dn8cQo/edit?usp=sharing</resume_link>
    <dob>8112000</dob>
    <isAdmin>0</isAdmin>
    <gender>M</gender>
    <pwd>admin</pwd>
  </row>
  <row>
    <user_id>CB.EN.U4CSE17422</user_id>
    <user_name>Arjun R</user_name>
    <mob>9445147933</mob>
    <email>arjun.prs@gmail.com</email>
    <resume_link>https://docs.google.com/document/d/16FaBtLR1Ena4AdPUfJ0PO9U_-UHshnKhB-GK2Dn8cQo/edit?usp=sharing</resume_link>
    <dob>8112000</dob>
    <isAdmin>0</isAdmin>
    <gender>M</gender>
    <pwd>admin</pwd>
  </row>
  <row>
    <user_id>CB.EN.U4CSE17423</user_id>
    <user_name>Arjun R</user_name>
    <mob>9445147934</mob>
    <email>arjun.prs@gmail.com</email>
    <resume_link>https://docs.google.com/document/d/16FaBtLR1Ena4AdPUfJ0PO9U_-UHshnKhB-GK2Dn8cQo/edit?usp=sharing</resume_link>
    <dob>8112000</dob>
    <isAdmin>0</isAdmin>
    <gender>M</gender>
    <pwd>admin</pwd>
  </row>
  <row>
    <user_id>CB.EN.U4CSE17424</user_id>
    <user_name>Arjun R</user_name>
    <mob>9445147935</mob>
    <email>arjun.prs@gmail.com</email>
    <resume_link>https://docs.google.com/document/d/16FaBtLR1Ena4AdPUfJ0PO9U_-UHshnKhB-GK2Dn8cQo/edit?usp=sharing</resume_link>
    <dob>8112000</dob>
    <isAdmin>0</isAdmin>
    <gender>M</gender>
    <pwd>admin</pwd>
  </row>
  <row>
    <user_id>CB.EN.U4CSE17425</user_id>
    <user_name>Arjun R</user_name>
    <mob>9445147936</mob>
    <email>arjun.prs@gmail.com</email>
    <resume_link>https://docs.google.com/document/d/16FaBtLR1Ena4AdPUfJ0PO9U_-UHshnKhB-GK2Dn8cQo/edit?usp=sharing</resume_link>
    <dob>8112000</dob>
    <isAdmin>0</isAdmin>
    <gender>M</gender>
    <pwd>admin</pwd>
  </row>
  <row>
    <user_id>CB.EN.U4CSE17426</user_id>
    <user_name>Arjun R</user_name>
    <mob>9445147937</mob>
    <email>arjun.prs@gmail.com</email>
    <resume_link>https://docs.google.com/document/d/16FaBtLR1Ena4AdPUfJ0PO9U_-UHshnKhB-GK2Dn8cQo/edit?usp=sharing</resume_link>
    <dob>8112000</dob>
    <isAdmin>0</isAdmin>
    <gender>M</gender>
    <pwd>admin</pwd>
  </row>
  <row>
    <user_id>CB.EN.U4CSE17427</user_id>
    <user_name>Arjun R</user_name>
    <mob>9445147938</mob>
    <email>arjun.prs@gmail.com</email>
    <resume_link>https://docs.google.com/document/d/16FaBtLR1Ena4AdPUfJ0PO9U_-UHshnKhB-GK2Dn8cQo/edit?usp=sharing</resume_link>
    <dob>8112000</dob>
    <isAdmin>0</isAdmin>
    <gender>M</gender>
    <pwd>admin</pwd>
  </row>
  <row>
    <user_id>CB.EN.U4CSE17428</user_id>
    <user_name>Arjun R</user_name>
    <mob>9445147939</mob>
    <email>arjun.prs@gmail.com</email>
    <resume_link>https://docs.google.com/document/d/16FaBtLR1Ena4AdPUfJ0PO9U_-UHshnKhB-GK2Dn8cQo/edit?usp=sharing</resume_link>
    <dob>8112000</dob>
    <isAdmin>0</isAdmin>
    <gender>M</gender>
    <pwd>admin</pwd>
  </row>
  <row>
    <user_id>CB.EN.U4CSE17429</user_id>
    <user_name>Arjun R</user_name>
    <mob>9445147940</mob>
    <email>arjun.prs@gmail.com</email>
    <resume_link>https://docs.google.com/document/d/16FaBtLR1Ena4AdPUfJ0PO9U_-UHshnKhB-GK2Dn8cQo/edit?usp=sharing</resume_link>
    <dob>8112000</dob>
    <isAdmin>0</isAdmin>
    <gender>M</gender>
    <pwd>admin</pwd>
  </row>
  <row>
    <user_id>CB.EN.U4CSE17430</user_id>
    <user_name>Arjun R</user_name>
    <mob>9445147941</mob>
    <email>arjun.prs@gmail.com</email>
    <resume_link>https://docs.google.com/document/d/16FaBtLR1Ena4AdPUfJ0PO9U_-UHshnKhB-GK2Dn8cQo/edit?usp=sharing</resume_link>
    <dob>8112000</dob>
    <isAdmin>0</isAdmin>
    <gender>M</gender>
    <pwd>admin</pwd>
  </row>
  <row>
    <user_id>CB.EN.U4CSE17431</user_id>
    <user_name>Arjun R</user_name>
    <mob>9445147942</mob>
    <email>arjun.prs@gmail.com</email>
    <resume_link>https://docs.google.com/document/d/16FaBtLR1Ena4AdPUfJ0PO9U_-UHshnKhB-GK2Dn8cQo/edit?usp=sharing</resume_link>
    <dob>8112000</dob>
    <isAdmin>0</isAdmin>
    <gender>M</gender>
    <pwd>admin</pwd>
  </row>
  <row>
    <user_id>CB.EN.U4CSE17432</user_id>
    <user_name>Arjun R</user_name>
    <mob>9445147943</mob>
    <email>arjun.prs@gmail.com</email>
    <resume_link>https://docs.google.com/document/d/16FaBtLR1Ena4AdPUfJ0PO9U_-UHshnKhB-GK2Dn8cQo/edit?usp=sharing</resume_link>
    <dob>8112000</dob>
    <isAdmin>0</isAdmin>
    <gender>M</gender>
    <pwd>admin</pwd>
  </row>
  <row>
    <user_id>CB.EN.U4CSE17433</user_id>
    <user_name>Arjun R</user_name>
    <mob>9445147944</mob>
    <email>arjun.prs@gmail.com</email>
    <resume_link>https://docs.google.com/document/d/16FaBtLR1Ena4AdPUfJ0PO9U_-UHshnKhB-GK2Dn8cQo/edit?usp=sharing</resume_link>
    <dob>8112000</dob>
    <isAdmin>0</isAdmin>
    <gender>M</gender>
    <pwd>admin</pwd>
  </row>
  <row>
    <user_id>CB.EN.U4CSE17434</user_id>
    <user_name>Arjun R</user_name>
    <mob>9445147945</mob>
    <email>arjun.prs@gmail.com</email>
    <resume_link>https://docs.google.com/document/d/16FaBtLR1Ena4AdPUfJ0PO9U_-UHshnKhB-GK2Dn8cQo/edit?usp=sharing</resume_link>
    <dob>8112000</dob>
    <isAdmin>0</isAdmin>
    <gender>M</gender>
    <pwd>admin</pwd>
  </row>
  <row>
    <user_id>CB.EN.U4CSE17435</user_id>
    <user_name>Arjun R</user_name>
    <mob>9445147946</mob>
    <email>arjun.prs@gmail.com</email>
    <resume_link>https://docs.google.com/document/d/16FaBtLR1Ena4AdPUfJ0PO9U_-UHshnKhB-GK2Dn8cQo/edit?usp=sharing</resume_link>
    <dob>8112000</dob>
    <isAdmin>0</isAdmin>
    <gender>M</gender>
    <pwd>admin</pwd>
  </row>
  <row>
    <user_id>CB.EN.U4CSE17436</user_id>
    <user_name>Arjun R</user_name>
    <mob>9445147947</mob>
    <email>arjun.prs@gmail.com</email>
    <resume_link>https://docs.google.com/document/d/16FaBtLR1Ena4AdPUfJ0PO9U_-UHshnKhB-GK2Dn8cQo/edit?usp=sharing</resume_link>
    <dob>8112000</dob>
    <isAdmin>0</isAdmin>
    <gender>M</gender>
    <pwd>admin</pwd>
  </row>
  <row>
    <user_id>CB.EN.U4CSE17437</user_id>
    <user_name>Arjun R</user_name>
    <mob>9445147948</mob>
    <email>arjun.prs@gmail.com</email>
    <resume_link>https://docs.google.com/document/d/16FaBtLR1Ena4AdPUfJ0PO9U_-UHshnKhB-GK2Dn8cQo/edit?usp=sharing</resume_link>
    <dob>8112000</dob>
    <isAdmin>0</isAdmin>
    <gender>M</gender>
    <pwd>admin</pwd>
  </row>
  <row>
    <user_id>CB.EN.U4CSE17438</user_id>
    <user_name>Arjun R</user_name>
    <mob>9445147949</mob>
    <email>arjun.prs@gmail.com</email>
    <resume_link>https://docs.google.com/document/d/16FaBtLR1Ena4AdPUfJ0PO9U_-UHshnKhB-GK2Dn8cQo/edit?usp=sharing</resume_link>
    <dob>8112000</dob>
    <isAdmin>0</isAdmin>
    <gender>M</gender>
    <pwd>admin</pwd>
  </row>
  <row>
    <user_id>CB.EN.U4CSE17439</user_id>
    <user_name>Arjun R</user_name>
    <mob>9445147950</mob>
    <email>arjun.prs@gmail.com</email>
    <resume_link>https://docs.google.com/document/d/16FaBtLR1Ena4AdPUfJ0PO9U_-UHshnKhB-GK2Dn8cQo/edit?usp=sharing</resume_link>
    <dob>8112000</dob>
    <isAdmin>0</isAdmin>
    <gender>M</gender>
    <pwd>admin</pwd>
  </row>
  <row>
    <user_id>CB.EN.U4CSE17440</user_id>
    <user_name>Arjun R</user_name>
    <mob>9445147951</mob>
    <email>arjun.prs@gmail.com</email>
    <resume_link>https://docs.google.com/document/d/16FaBtLR1Ena4AdPUfJ0PO9U_-UHshnKhB-GK2Dn8cQo/edit?usp=sharing</resume_link>
    <dob>8112000</dob>
    <isAdmin>0</isAdmin>
    <gender>M</gender>
    <pwd>admin</pwd>
  </row>
  <row>
    <user_id>CB.EN.U4CSE17441</user_id>
    <user_name>Arjun R</user_name>
    <mob>9445147952</mob>
    <email>arjun.prs@gmail.com</email>
    <resume_link>https://docs.google.com/document/d/16FaBtLR1Ena4AdPUfJ0PO9U_-UHshnKhB-GK2Dn8cQo/edit?usp=sharing</resume_link>
    <dob>8112000</dob>
    <isAdmin>0</isAdmin>
    <gender>M</gender>
    <pwd>admin</pwd>
  </row>
  <row>
    <user_id>CB.EN.U4CSE17442</user_id>
    <user_name>Arjun R</user_name>
    <mob>9445147953</mob>
    <email>arjun.prs@gmail.com</email>
    <resume_link>https://docs.google.com/document/d/16FaBtLR1Ena4AdPUfJ0PO9U_-UHshnKhB-GK2Dn8cQo/edit?usp=sharing</resume_link>
    <dob>8112000</dob>
    <isAdmin>0</isAdmin>
    <gender>M</gender>
    <pwd>admin</pwd>
  </row>
  <row>
    <user_id>CB.EN.U4CSE17443</user_id>
    <user_name>Arjun R</user_name>
    <mob>9445147954</mob>
    <email>arjun.prs@gmail.com</email>
    <resume_link>https://docs.google.com/document/d/16FaBtLR1Ena4AdPUfJ0PO9U_-UHshnKhB-GK2Dn8cQo/edit?usp=sharing</resume_link>
    <dob>8112000</dob>
    <isAdmin>0</isAdmin>
    <gender>M</gender>
    <pwd>admin</pwd>
  </row>
  <row>
    <user_id>CB.EN.U4CSE17444</user_id>
    <user_name>Arjun R</user_name>
    <mob>9445147955</mob>
    <email>arjun.prs@gmail.com</email>
    <resume_link>https://docs.google.com/document/d/16FaBtLR1Ena4AdPUfJ0PO9U_-UHshnKhB-GK2Dn8cQo/edit?usp=sharing</resume_link>
    <dob>8112000</dob>
    <isAdmin>0</isAdmin>
    <gender>M</gender>
    <pwd>admin</pwd>
  </row>
  <row>
    <user_id>CB.EN.U4CSE17445</user_id>
    <user_name>Arjun R</user_name>
    <mob>9445147956</mob>
    <email>arjun.prs@gmail.com</email>
    <resume_link>https://docs.google.com/document/d/16FaBtLR1Ena4AdPUfJ0PO9U_-UHshnKhB-GK2Dn8cQo/edit?usp=sharing</resume_link>
    <dob>8112000</dob>
    <isAdmin>0</isAdmin>
    <gender>M</gender>
    <pwd>admin</pwd>
  </row>
  <row>
    <user_id>CB.EN.U4CSE17446</user_id>
    <user_name>Arjun R</user_name>
    <mob>9445147957</mob>
    <email>arjun.prs@gmail.com</email>
    <resume_link>https://docs.google.com/document/d/16FaBtLR1Ena4AdPUfJ0PO9U_-UHshnKhB-GK2Dn8cQo/edit?usp=sharing</resume_link>
    <dob>8112000</dob>
    <isAdmin>0</isAdmin>
    <gender>M</gender>
    <pwd>admin</pwd>
  </row>
  <row>
    <user_id>CB.EN.U4CSE17447</user_id>
    <user_name>Arjun R</user_name>
    <mob>9445147958</mob>
    <email>arjun.prs@gmail.com</email>
    <resume_link>https://docs.google.com/document/d/16FaBtLR1Ena4AdPUfJ0PO9U_-UHshnKhB-GK2Dn8cQo/edit?usp=sharing</resume_link>
    <dob>8112000</dob>
    <isAdmin>0</isAdmin>
    <gender>M</gender>
    <pwd>admin</pwd>
  </row>
  <row>
    <user_id>CB.EN.U4CSE17448</user_id>
    <user_name>Arjun R</user_name>
    <mob>9445147959</mob>
    <email>arjun.prs@gmail.com</email>
    <resume_link>https://docs.google.com/document/d/16FaBtLR1Ena4AdPUfJ0PO9U_-UHshnKhB-GK2Dn8cQo/edit?usp=sharing</resume_link>
    <dob>8112000</dob>
    <isAdmin>0</isAdmin>
    <gender>M</gender>
    <pwd>admin</pwd>
  </row>
  <row>
    <user_id>CB.EN.U4CSE17449</user_id>
    <user_name>Arjun R</user_name>
    <mob>9445147960</mob>
    <email>arjun.prs@gmail.com</email>
    <resume_link>https://docs.google.com/document/d/16FaBtLR1Ena4AdPUfJ0PO9U_-UHshnKhB-GK2Dn8cQo/edit?usp=sharing</resume_link>
    <dob>8112000</dob>
    <isAdmin>0</isAdmin>
    <gender>M</gender>
    <pwd>admin</pwd>
  </row>
  <row>
    <user_id>CB.EN.U4CSE17450</user_id>
    <user_name>Arjun R</user_name>
    <mob>9445147961</mob>
    <email>arjun.prs@gmail.com</email>
    <resume_link>https://docs.google.com/document/d/16FaBtLR1Ena4AdPUfJ0PO9U_-UHshnKhB-GK2Dn8cQo/edit?usp=sharing</resume_link>
    <dob>8112000</dob>
    <isAdmin>0</isAdmin>
    <gender>M</gender>
    <pwd>admin</pwd>
  </row>
  <row>
    <user_id>CB.EN.U4CSE17451</user_id>
    <user_name>Arjun R</user_name>
    <mob>9445147962</mob>
    <email>arjun.prs@gmail.com</email>
    <resume_link>https://docs.google.com/document/d/16FaBtLR1Ena4AdPUfJ0PO9U_-UHshnKhB-GK2Dn8cQo/edit?usp=sharing</resume_link>
    <dob>8112000</dob>
    <isAdmin>0</isAdmin>
    <gender>M</gender>
    <pwd>admin</pwd>
  </row>
  <row>
    <user_id>CB.EN.U4CSE17452</user_id>
    <user_name>Arjun R</user_name>
    <mob>9445147963</mob>
    <email>arjun.prs@gmail.com</email>
    <resume_link>https://docs.google.com/document/d/16FaBtLR1Ena4AdPUfJ0PO9U_-UHshnKhB-GK2Dn8cQo/edit?usp=sharing</resume_link>
    <dob>8112000</dob>
    <isAdmin>0</isAdmin>
    <gender>M</gender>
    <pwd>admin</pwd>
  </row>
  <row>
    <user_id>CB.EN.U4CSE17453</user_id>
    <user_name>Arjun R</user_name>
    <mob>9445147964</mob>
    <email>arjun.prs@gmail.com</email>
    <resume_link>https://docs.google.com/document/d/16FaBtLR1Ena4AdPUfJ0PO9U_-UHshnKhB-GK2Dn8cQo/edit?usp=sharing</resume_link>
    <dob>8112000</dob>
    <isAdmin>0</isAdmin>
    <gender>M</gender>
    <pwd>admin</pwd>
  </row>
  <row>
    <user_id>CB.EN.U4CSE17454</user_id>
    <user_name>Arjun R</user_name>
    <mob>9445147965</mob>
    <email>arjun.prs@gmail.com</email>
    <resume_link>https://docs.google.com/document/d/16FaBtLR1Ena4AdPUfJ0PO9U_-UHshnKhB-GK2Dn8cQo/edit?usp=sharing</resume_link>
    <dob>8112000</dob>
    <isAdmin>0</isAdmin>
    <gender>M</gender>
    <pwd>admin</pwd>
  </row>
  <row>
    <user_id>CB.EN.U4CSE17455</user_id>
    <user_name>Arjun R</user_name>
    <mob>9445147966</mob>
    <email>arjun.prs@gmail.com</email>
    <resume_link>https://docs.google.com/document/d/16FaBtLR1Ena4AdPUfJ0PO9U_-UHshnKhB-GK2Dn8cQo/edit?usp=sharing</resume_link>
    <dob>8112000</dob>
    <isAdmin>0</isAdmin>
    <gender>M</gender>
    <pwd>admin</pwd>
  </row>
  <row>
    <user_id>CB.EN.U4CSE17456</user_id>
    <user_name>Arjun R</user_name>
    <mob>9445147967</mob>
    <email>arjun.prs@gmail.com</email>
    <resume_link>https://docs.google.com/document/d/16FaBtLR1Ena4AdPUfJ0PO9U_-UHshnKhB-GK2Dn8cQo/edit?usp=sharing</resume_link>
    <dob>8112000</dob>
    <isAdmin>0</isAdmin>
    <gender>M</gender>
    <pwd>admin</pwd>
  </row>
  <row>
    <user_id>CB.EN.U4CSE17457</user_id>
    <user_name>Arjun R</user_name>
    <mob>9445147968</mob>
    <email>arjun.prs@gmail.com</email>
    <resume_link>https://docs.google.com/document/d/16FaBtLR1Ena4AdPUfJ0PO9U_-UHshnKhB-GK2Dn8cQo/edit?usp=sharing</resume_link>
    <dob>8112000</dob>
    <isAdmin>0</isAdmin>
    <gender>M</gender>
    <pwd>admin</pwd>
  </row>
  <row>
    <user_id>CB.EN.U4CSE17458</user_id>
    <user_name>Arjun R</user_name>
    <mob>9445147969</mob>
    <email>arjun.prs@gmail.com</email>
    <resume_link>https://docs.google.com/document/d/16FaBtLR1Ena4AdPUfJ0PO9U_-UHshnKhB-GK2Dn8cQo/edit?usp=sharing</resume_link>
    <dob>8112000</dob>
    <isAdmin>0</isAdmin>
    <gender>M</gender>
    <pwd>admin</pwd>
  </row>
  <row>
    <user_id>CB.EN.U4CSE17459</user_id>
    <user_name>Arjun R</user_name>
    <mob>9445147970</mob>
    <email>arjun.prs@gmail.com</email>
    <resume_link>https://docs.google.com/document/d/16FaBtLR1Ena4AdPUfJ0PO9U_-UHshnKhB-GK2Dn8cQo/edit?usp=sharing</resume_link>
    <dob>8112000</dob>
    <isAdmin>0</isAdmin>
    <gender>M</gender>
    <pwd>admin</pwd>
  </row>
  <row>
    <user_id>CB.EN.U4CSE17460</user_id>
    <user_name>Arjun R</user_name>
    <mob>9445147971</mob>
    <email>arjun.prs@gmail.com</email>
    <resume_link>https://docs.google.com/document/d/16FaBtLR1Ena4AdPUfJ0PO9U_-UHshnKhB-GK2Dn8cQo/edit?usp=sharing</resume_link>
    <dob>8112000</dob>
    <isAdmin>0</isAdmin>
    <gender>M</gender>
    <pwd>admin</pwd>
  </row>
  <row>
    <user_id>CB.EN.U4CSE17461</user_id>
    <user_name>Arjun R</user_name>
    <mob>9445147972</mob>
    <email>arjun.prs@gmail.com</email>
    <resume_link>https://docs.google.com/document/d/16FaBtLR1Ena4AdPUfJ0PO9U_-UHshnKhB-GK2Dn8cQo/edit?usp=sharing</resume_link>
    <dob>8112000</dob>
    <isAdmin>0</isAdmin>
    <gender>M</gender>
    <pwd>admin</pwd>
  </row>
  <row>
    <user_id>CB.EN.U4CSE17462</user_id>
    <user_name>Arjun R</user_name>
    <mob>9445147973</mob>
    <email>arjun.prs@gmail.com</email>
    <resume_link>https://docs.google.com/document/d/16FaBtLR1Ena4AdPUfJ0PO9U_-UHshnKhB-GK2Dn8cQo/edit?usp=sharing</resume_link>
    <dob>8112000</dob>
    <isAdmin>0</isAdmin>
    <gender>M</gender>
    <pwd>admin</pwd>
  </row>
  <row>
    <user_id>CB.EN.U4CSE17463</user_id>
    <user_name>Arjun R</user_name>
    <mob>9445147974</mob>
    <email>arjun.prs@gmail.com</email>
    <resume_link>https://docs.google.com/document/d/16FaBtLR1Ena4AdPUfJ0PO9U_-UHshnKhB-GK2Dn8cQo/edit?usp=sharing</resume_link>
    <dob>8112000</dob>
    <isAdmin>0</isAdmin>
    <gender>M</gender>
    <pwd>admin</pwd>
  </row>
  <row>
    <user_id>CB.EN.U4CSE17464</user_id>
    <user_name>Arjun R</user_name>
    <mob>9445147975</mob>
    <email>arjun.prs@gmail.com</email>
    <resume_link>https://docs.google.com/document/d/16FaBtLR1Ena4AdPUfJ0PO9U_-UHshnKhB-GK2Dn8cQo/edit?usp=sharing</resume_link>
    <dob>8112000</dob>
    <isAdmin>0</isAdmin>
    <gender>M</gender>
    <pwd>admin</pwd>
  </row>
  <row>
    <user_id>CB.EN.U4CSE17465</user_id>
    <user_name>Arjun R</user_name>
    <mob>9445147976</mob>
    <email>arjun.prs@gmail.com</email>
    <resume_link>https://docs.google.com/document/d/16FaBtLR1Ena4AdPUfJ0PO9U_-UHshnKhB-GK2Dn8cQo/edit?usp=sharing</resume_link>
    <dob>8112000</dob>
    <isAdmin>0</isAdmin>
    <gender>M</gender>
    <pwd>admin</pwd>
  </row>
  <row>
    <user_id>CB.EN.U4CSE17466</user_id>
    <user_name>Arjun R</user_name>
    <mob>9445147977</mob>
    <email>arjun.prs@gmail.com</email>
    <resume_link>https://docs.google.com/document/d/16FaBtLR1Ena4AdPUfJ0PO9U_-UHshnKhB-GK2Dn8cQo/edit?usp=sharing</resume_link>
    <dob>8112000</dob>
    <isAdmin>0</isAdmin>
    <gender>M</gender>
    <pwd>admin</pwd>
  </row>
  <row>
    <user_id>CB.EN.U4CSE17467</user_id>
    <user_name>Arjun R</user_name>
    <mob>9445147978</mob>
    <email>arjun.prs@gmail.com</email>
    <resume_link>https://docs.google.com/document/d/16FaBtLR1Ena4AdPUfJ0PO9U_-UHshnKhB-GK2Dn8cQo/edit?usp=sharing</resume_link>
    <dob>8112000</dob>
    <isAdmin>0</isAdmin>
    <gender>M</gender>
    <pwd>admin</pwd>
  </row>
  <row>
    <user_id>CB.EN.U4CSE17468</user_id>
    <user_name>Arjun R</user_name>
    <mob>9445147979</mob>
    <email>arjun.prs@gmail.com</email>
    <resume_link>https://docs.google.com/document/d/16FaBtLR1Ena4AdPUfJ0PO9U_-UHshnKhB-GK2Dn8cQo/edit?usp=sharing</resume_link>
    <dob>8112000</dob>
    <isAdmin>0</isAdmin>
    <gender>M</gender>
    <pwd>admin</pwd>
  </row>
  <row>
    <user_id>CB.EN.U4CSE17469</user_id>
    <user_name>Arjun R</user_name>
    <mob>9445147980</mob>
    <email>arjun.prs@gmail.com</email>
    <resume_link>https://docs.google.com/document/d/16FaBtLR1Ena4AdPUfJ0PO9U_-UHshnKhB-GK2Dn8cQo/edit?usp=sharing</resume_link>
    <dob>8112000</dob>
    <isAdmin>0</isAdmin>
    <gender>M</gender>
    <pwd>admin</pwd>
  </row>
  <row>
    <user_id>CB.EN.U4CSE17470</user_id>
    <user_name>Arjun R</user_name>
    <mob>9445147981</mob>
    <email>arjun.prs@gmail.com</email>
    <resume_link>https://docs.google.com/document/d/16FaBtLR1Ena4AdPUfJ0PO9U_-UHshnKhB-GK2Dn8cQo/edit?usp=sharing</resume_link>
    <dob>8112000</dob>
    <isAdmin>0</isAdmin>
    <gender>M</gender>
    <pwd>admin</pwd>
  </row>
</root>